Risk ID,Asset ID,Asset,Risk Description,Threats,Vulnerabilities,Likelihood,Impact,Risk Score,Risk Level,Treatment Option,Proposed Controls (Annex A 2022 + NGU policy),Residual Likelihood,Residual Impact,Residual Score,Residual Level,Risk Owner,Status
R01,A06,Identity & Access Management,Unauthorised remote access due to absence of enforced MFA and endpoint compliance,"Credential theft, account takeover","MFA not enforced, no device compliance",4,5,20,High,Mitigate,A.8.5 / A.5.17 / A.6.7 — enforce MFA (Access Control Policy NGU-POL-9.1); endpoint compliance & VPN (Remote Working Policy NGU-POL-6.2); route logs to SIEM,2,5,10,Medium,Head of IT Operations,Treatment in progress (Finding F1 / NC-001)
R02,A01–A07,Information assets (multiple),Critical assets unclassified or without active owner accountability,"Insider misuse, mismanagement","Inconsistent classification, no asset-level risk assessments",4,4,16,High,Mitigate,A.5.9 / A.5.10 / A.5.12 — IAO accountability & asset register (Asset Owners Handbook NGU-POL-8.1); classification (Information Classification Policy NGU-POL-8.2),2,4,8,Medium,Information Security Manager,Open (Finding F2 / NC-002)
R03,A01,Student Records System,Breach of student/staff personal data (UK GDPR),"Unauthorised access, exfiltration","Excessive access, weak authentication",3,5,15,High,Mitigate,"A.5.34 / A.8.3 / A.8.24 — access restriction & encryption (Access Control NGU-POL-9.1, Cryptographic Policy NGU-POL-10.1); PII handling (Classification NGU-POL-8.2)",2,5,10,Medium,Data Protection Officer,Open
R04,A05/A06,M365 / IAM,Control failure or breach goes undetected due to no monitoring or log review,Undetected compromise,"No log review, no KRIs/KCIs",4,3,12,Medium,Mitigate,"A.8.15 / A.8.16 / A.5.25 — centralised logging & monitoring, KRIs/KCIs (Incident Management Policy NGU-POL-16.1)",2,3,6,Low,Information Security Manager,Open (Finding F4 / NC-004)
R05,A01–A07,ISMS risk register,Risks left unmanaged because the risk register is not operationalised,Unmanaged risk accumulation,"No risk-register owner, no review cycle",4,3,12,Medium,Mitigate,"Clause 6.1 / Clause 8 — risk-register ownership & quarterly review (Risk Management Policy NGU-POL-IRM01, Methodology NGU-POL-4.1)",2,3,6,Low,Information Security Risk Manager,Open (Finding F3 / NC-003)
R06,A05,Microsoft 365 / Cloud services,Data exposure through cloud/third-party services without security assurance,"Misconfiguration, supplier breach","No cloud security baseline, weak supplier assurance",3,4,12,Medium,Mitigate,A.5.19 / A.5.23 — supplier due diligence (Supplier Security Policy NGU-POL-15.1); cloud security baseline (2022 transition gap),2,4,8,Medium,Procurement / Vendor Management,Open
R07,A07,Staff & Student Endpoints,Ransomware/malware compromise of endpoints and connected systems,"Ransomware, phishing","No endpoint-protection validation, unpatched devices",4,4,16,High,Mitigate,"A.8.7 / A.8.8 / A.8.1 — anti-malware, vulnerability & patch management, endpoint protection (Remote Working NGU-POL-6.2, Acceptable Use NGU-POL-8.1.3)",2,4,8,Medium,Head of IT Operations,Open
R08,A01,Student Records System,Personal data retained beyond need / no secure deletion (UK GDPR Art.17),Regulatory non-compliance,No deletion/retention schedule,3,3,9,Medium,Mitigate,A.8.10 / A.5.34 / A.5.12 — secure deletion & retention (Information Classification Policy NGU-POL-8.2 update; 2022 transition gap),2,3,6,Low,Data Protection Officer,Open
